{
  "$schema": "./schema.json",
  "registryVersion": "2026-10-30",
  "transcribedFrom": "DevAudit portal, commit 189ab4e",
  "code": "soc-2",
  "name": "SOC 2",
  "longName": "SOC 2 Trust Services Criteria",
  "edition": "AICPA TSC 2017",
  "clauses": [
    {
      "id": "SOC2.CC2.1",
      "title": "Communication of policies and objectives",
      "expects": [
        {
          "kind": "evidence_filename_any",
          "fileNames": [
            "INSTRUCTIONS.md",
            "AGENT.md"
          ],
          "freshnessDays": 365,
          "description": "One of the project's governance and communication documents is on file in the compliance documents and was refreshed within the last year. Either document satisfies the clause. The list of accepted documents differs on purpose from the one for the information-security policy clause in ISO 27001."
        }
      ]
    },
    {
      "id": "SOC2.CC3.2",
      "title": "Risk identification and assessment",
      "expects": [
        {
          "kind": "requirement_meta",
          "riskClass": "HIGH",
          "description": "Each high-risk requirement has an implementation plan that includes its threat model."
        },
        {
          "kind": "evidence_type_any",
          "types": [
            "risk_assessment"
          ],
          "description": "A per-requirement risk assessment summarises the risks opened, mitigated or accepted for the change. This is the direct evidence for the clause."
        }
      ]
    },
    {
      "id": "SOC2.CC4.1",
      "title": "Monitoring of internal controls",
      "expects": [
        {
          "kind": "evidence_type_any",
          "types": [
            "periodic_review"
          ],
          "freshnessDays": 365,
          "description": "Periodic reviews of control effectiveness are on file. A review older than a year still counts but is shown as expired."
        }
      ]
    },
    {
      "id": "SOC2.CC6.1",
      "title": "Logical and physical access controls",
      "expects": [
        {
          "kind": "portal_invariant",
          "description": "Role-based access and a second authentication factor are built into the portal, so the control is part of how the portal works."
        },
        {
          "kind": "evidence_type_any",
          "types": [
            "security_summary"
          ],
          "description": "A per-requirement security summary records the access-control review."
        }
      ]
    },
    {
      "id": "SOC2.CC7.2",
      "title": "System monitoring and incident response",
      "expects": [
        {
          "kind": "evidence_type_any",
          "types": [
            "incident_report"
          ],
          "description": "Operational incidents are on file as incident reports."
        },
        {
          "kind": "evidence_type_any",
          "types": [
            "gate_outcome"
          ],
          "description": "The pass or fail outcome of each pipeline gate is recorded."
        },
        {
          "kind": "evidence_type_any",
          "types": [
            "smoke_test"
          ],
          "description": "Smoke-test results from after a production deployment show that production is being monitored."
        }
      ]
    },
    {
      "id": "SOC2.CC8.1",
      "title": "Change management (segregation of duties)",
      "expects": [
        {
          "kind": "audit_event_any",
          "eventTypes": [
            "release.independently_approved"
          ],
          "description": "Met by a release approval made by someone other than the release's creator or submitter. A release approved by its own creator or submitter, where the project's approval policy allows it with a recorded gap, is recorded as a self-approval instead and is shown as a gap."
        }
      ]
    },
    {
      "id": "SOC2.PI1.1",
      "title": "Processing integrity (test evidence)",
      "expects": [
        {
          "kind": "evidence_type_any",
          "types": [
            "e2e_result",
            "test_report"
          ],
          "description": "Test results from the delivery pipeline show that processing behaves as specified."
        }
      ]
    },
    {
      "id": "SOC2.C1.1",
      "title": "Confidentiality (signed downloads)",
      "expects": [
        {
          "kind": "portal_invariant",
          "description": "Evidence is served only through signed links that expire within an hour, so the control is part of how the portal works."
        }
      ]
    }
  ]
}
